Addressed to,2013,2014,2015,2016,2017,2018,2019,2020,2021,2022,2023,2024,Total,% completed,completed,partial,overdue,pending
Department of Health and Social Care,19,60,55,47,31,50,48,46,65,78,98,113,710,55,389,173,128,20
NHS England,6,25,22,34,27,37,45,26,42,46,86,95,491,46,228,133,110,20
Care Quality Commission,11,13,10,15,20,13,14,10,18,11,12,21,168,35,58,60,46,4
HM Prison and Probation Service,4,15,17,14,13,10,24,5,7,6,17,20,152,41,63,46,41,2
Ministry of Justice,1,12,6,8,1,8,13,0,14,11,11,18,103,24,25,43,32,3
Home Office,2,8,10,5,4,5,12,8,13,11,11,12,101,39,39,40,17,5
NHS Greater Manchester Integrated Care Board,1,3,2,1,6,4,16,12,20,11,10,13,99,59,58,19,21,1
National Institute for Health and Care Excellence,1,10,9,4,3,1,11,7,10,5,17,19,97,38,37,26,30,4
Department for Transport,1,12,6,12,9,5,6,8,7,7,11,11,95,44,42,26,24,3
Betsi Cadwaladr University Health Board,1,9,8,4,7,2,2,1,4,4,21,9,72,72,52,3,17,0
Barts Health NHS Trust,0,5,5,6,5,7,9,8,2,6,8,5,66,52,34,11,20,1
REDACTED,3,24,7,0,3,1,2,0,0,4,6,16,66,21,14,29,22,1
National Highways,1,7,8,4,7,1,9,4,4,7,7,5,64,45,29,8,27,0
Metropolitan Police Service,2,4,7,5,3,6,6,5,5,7,6,5,61,54,33,15,12,1
University Hospitals Sussex NHS Foundation Trust,1,11,5,11,6,6,6,1,4,2,3,3,59,51,30,12,16,1
Medicines and Healthcare Products Regulatory Agency,1,8,4,6,4,5,6,5,3,3,7,7,59,36,21,19,18,1
National Police Chiefs’ Council,1,3,5,2,2,2,8,2,11,3,10,6,55,27,15,31,9,0
Health and Safety Executive,4,3,3,4,5,5,9,1,4,3,9,4,54,41,22,16,16,0
Pennine Care NHS Foundation Trust,2,2,4,4,5,7,8,5,1,2,5,3,48,44,21,13,14,0
Department for Education,1,3,3,4,1,3,8,1,4,4,5,10,47,38,18,15,11,3
Welsh Ambulance Services University NHS Trust,2,0,1,5,4,7,6,2,0,6,9,5,47,55,26,7,12,2
Greater Manchester Mental Health NHS Foundation Trust,1,4,5,3,2,3,7,3,7,6,3,1,45,40,18,12,14,1
Sussex Partnership NHS Foundation Trust,2,7,4,3,6,2,2,3,6,1,5,3,44,57,25,7,11,1
Northern Care Alliance NHS Foundation Trust,3,1,6,2,8,5,9,0,4,0,1,2,41,51,21,9,10,1
Network Rail,0,6,2,4,5,7,5,2,4,2,3,1,41,63,26,5,10,0
Manchester University NHS Foundation Trust,0,5,3,9,1,6,6,3,1,2,1,3,40,40,16,6,18,0
College of Policing,0,1,1,1,0,1,7,3,5,5,9,5,38,39,15,16,6,1
East London NHS Foundation Trust,0,2,0,3,10,1,2,1,1,6,5,6,37,54,20,4,12,1
Norfolk and Suffolk NHS Foundation Trust,1,4,4,0,4,2,7,1,3,5,0,6,37,68,25,4,7,1
"Ministry of Housing, Communities and Local Government",1,3,4,1,2,1,4,4,2,2,3,9,36,56,20,7,8,1
General Medical Council,2,5,4,1,1,3,3,3,6,2,4,1,35,26,9,16,10,0
Stockport NHS Foundation Trust,3,4,4,7,4,3,2,1,2,1,1,2,34,53,18,2,14,0
Greater Manchester Police,0,3,6,4,0,1,5,2,4,3,2,4,34,53,18,11,4,1
Association of Ambulance Chief Executives,0,2,1,1,1,0,3,8,1,6,7,4,34,21,7,19,7,1
Birmingham and Solihull Mental Health NHS Foundation Trust,0,1,1,2,1,3,7,1,1,3,8,5,33,73,24,7,2,0
Cwm Taf Morgannwg University Health Board,0,6,5,1,3,4,6,1,2,2,0,3,33,42,14,5,14,0
Essex Partnership University NHS Foundation Trust,0,1,3,4,4,2,0,3,2,3,4,6,32,44,14,6,12,0
Tameside and Glossop Integrated Care NHS Foundation Trust,0,3,2,3,3,1,4,3,2,5,3,3,32,59,19,5,8,0
Central and North West London NHS Foundation Trust,0,2,2,2,2,2,6,2,5,3,1,4,31,39,12,8,10,1
Ministry of Defence,1,5,8,0,1,2,3,1,2,1,3,4,31,61,19,6,5,1
University Hospitals Birmingham NHS Foundation Trust,1,0,4,2,2,2,4,1,2,0,3,10,31,58,18,5,4,4
North East London NHS Foundation Trust,0,0,1,3,0,1,5,2,5,3,7,2,29,45,13,4,11,1
"Barking, Havering and Redbridge University Hospitals NHS Trust",2,2,3,0,3,0,1,2,3,3,7,3,29,45,13,3,12,1
Midlands Partnership University NHS Foundation Trust,1,1,2,0,4,4,3,2,1,1,2,5,26,58,15,4,6,1
London Ambulance Service NHS Trust,2,2,4,2,2,3,4,3,3,0,1,0,26,35,9,10,7,0
"Tees, Esk and Wear Valley NHS Foundation Trust",3,7,0,2,2,0,0,1,1,2,5,3,26,54,14,7,4,1
Nottinghamshire Healthcare NHS Foundation Trust,0,1,3,4,2,0,0,0,2,3,6,5,26,54,14,3,8,1
Royal College of Paediatrics and Child Health,0,4,1,1,1,0,2,1,3,2,6,5,26,38,10,10,5,1
Welsh Government,1,1,3,4,5,2,3,0,1,0,0,5,25,36,9,10,5,1
Aneurin Bevan University Health Board,0,1,2,1,3,2,0,2,3,3,5,3,25,56,14,3,8,0
Surrey and Borders Partnership NHS Foundation Trust,1,3,3,1,2,1,1,1,1,3,4,3,24,38,9,6,8,1
Care UK,1,6,1,6,5,0,3,1,0,0,1,0,24,38,9,14,1,0
Blackpool Teaching Hospitals NHS Foundation Trust,1,5,1,3,1,2,4,2,1,1,1,2,24,58,14,1,9,0
Royal College of Obstetricians and Gynaecologists,1,1,3,3,2,1,1,4,1,1,4,2,24,25,6,11,6,1
University Hospitals of North Midlands NHS Trust,1,1,3,1,2,2,3,0,4,0,4,3,24,62,15,1,6,2
Swansea Bay University Health Board,1,0,3,3,3,0,5,0,1,1,2,5,24,38,9,9,5,1
Royal College of General Practitioners,2,3,1,1,2,0,1,1,4,2,2,5,24,42,10,8,4,2
Camden and Islington NHS Foundation Trust,2,3,6,1,4,1,1,1,1,1,1,1,23,57,13,4,6,0
Leeds Teaching Hospitals NHS Trust,0,2,4,2,2,3,2,3,2,1,0,2,23,52,12,1,9,1
Oxleas NHS Foundation Trust,0,1,0,2,1,5,2,4,1,3,2,2,23,48,11,6,6,0
Cardiff and Vale University Health Board,1,1,3,2,2,4,3,2,0,2,1,2,23,43,10,8,4,1
Transport for London,1,1,2,2,6,3,2,3,1,2,0,0,23,48,11,7,5,0
"Department for Culture, Media and Sport",0,0,1,0,0,1,3,1,2,3,6,5,22,45,10,8,3,1
University Hospitals Dorset NHS Foundation Trust,2,10,3,5,1,0,0,0,0,1,0,0,22,59,13,2,7,0
Cornwall Council,0,1,2,3,0,1,3,0,4,3,2,3,22,64,14,3,5,0
East Midlands Ambulance Service NHS Trust,0,1,4,3,1,2,4,1,1,1,1,2,21,48,10,8,3,0
NHS Derby and Derbyshire Integrated Care Board,1,5,0,4,1,3,0,2,2,1,0,2,21,29,6,7,6,2
NHS Birmingham and Solihull Integrated Care Board,0,0,0,1,1,7,5,0,2,1,2,2,21,76,16,3,2,0
North West Ambulance Service NHS Trust,1,3,2,2,2,1,3,1,1,1,2,2,21,62,13,3,4,1
Royal College of Psychiatrists,0,3,0,1,1,2,1,0,2,6,4,1,21,29,6,11,4,0
Avon and Wiltshire Mental Health Partnership NHS Trust,1,0,8,4,2,1,3,0,1,1,0,0,21,43,9,7,5,0
West Midlands Police,0,2,0,1,1,1,4,1,2,2,2,4,20,55,11,7,1,1
East of England Ambulance Service NHS Trust,0,2,2,1,0,1,5,0,1,2,4,2,20,65,13,2,5,0
South London and Maudsley NHS Foundation Trust,1,6,1,2,2,4,0,2,0,0,0,2,20,45,9,5,6,0
East Kent Hospitals University NHS Foundation Trust,0,5,2,1,4,0,1,1,1,3,1,1,20,45,9,1,10,0
Herefordshire and Worcestershire Health and Care NHS Trust,2,0,4,3,0,1,1,1,0,3,2,3,20,55,11,4,4,1
University Hospitals Plymouth NHS Trust,2,2,2,2,0,3,5,1,1,1,1,0,20,55,11,1,8,0
Devon Partnership NHS Trust,0,2,3,2,3,1,0,2,2,1,3,0,19,74,14,3,2,0
Surrey County Council,0,2,0,3,2,1,0,2,0,2,2,5,19,26,5,8,4,2
The Queen Elizabeth Hospital King's Lynn NHS Foundation Trust,0,2,1,0,1,2,4,2,1,2,2,1,18,67,12,4,2,0
Nursing and Midwifery Council,0,2,0,1,3,1,4,1,1,1,1,3,18,39,7,4,7,0
Public Health England,0,2,2,0,2,1,5,3,3,0,0,0,18,22,4,7,7,0
Civil Aviation Authority,0,0,2,5,1,1,2,1,2,0,2,1,17,71,12,2,3,0
Medway NHS Foundation Trust,0,0,1,4,1,2,1,0,6,2,0,0,17,53,9,0,8,0
Kent and Medway NHS and Social Care Partnership Trust,1,2,1,1,2,1,1,0,3,3,1,1,17,41,7,4,6,0
United Lincolnshire Hospitals NHS Trust,2,2,2,1,3,1,1,1,1,1,1,0,16,44,7,1,8,0
Priory Group,0,2,2,2,2,0,1,2,1,1,1,2,16,50,8,3,5,0
Cumbria County Council,2,3,1,3,2,0,2,1,0,2,0,0,16,56,9,1,6,0
Surrey Police,0,3,1,0,0,1,4,2,0,1,1,3,16,25,4,6,6,0
Milton Keynes University Hospital NHS Foundation Trust,0,2,1,0,1,0,2,1,3,2,4,0,16,62,10,2,4,0
South Central Ambulance Service NHS Foundation Trust,3,0,0,1,4,1,4,1,0,2,0,0,16,38,6,4,6,0
North East Ambulance Service NHS Foundation Trust,0,1,1,3,1,2,2,0,0,2,1,3,16,44,7,2,7,0
St George’s University Hospitals NHS Foundation Trust,0,1,1,5,2,2,1,2,1,1,0,0,16,19,3,6,7,0
Leicestershire Partnership NHS Trust,1,2,4,3,1,1,0,0,0,0,1,2,15,87,13,0,2,0
University Hospitals of Derby and Burton NHS Foundation Trust,1,1,1,0,0,0,2,3,0,1,3,3,15,47,7,4,3,1
King’s College Hospital NHS Foundation Trust,1,3,2,1,3,0,1,0,1,3,0,0,15,40,6,3,6,0
Bedfordshire Hospitals NHS Foundation Trust,0,4,1,2,2,1,3,1,0,1,0,0,15,67,10,1,4,0
NHS Digital,0,0,0,1,1,1,3,3,2,2,2,0,15,53,8,5,2,0
Black Country Healthcare NHS Foundation Trust,0,3,0,2,2,2,3,0,1,0,0,2,15,53,8,3,4,0
Royal College of Anaesthetists,0,2,1,0,2,1,0,0,2,1,1,5,15,47,7,7,1,0
Doncaster and Bassetlaw Teaching Hospitals NHS Foundation Trust,1,1,1,3,2,3,1,0,1,1,0,1,15,73,11,0,4,0
South East Coast Ambulance Service NHS Foundation Trust,0,0,0,0,1,2,4,1,2,0,3,2,15,67,10,0,4,1
University Hospitals of Leicester NHS Trust,0,3,6,1,1,1,1,0,0,0,1,1,15,87,13,1,1,0
Worcestershire Acute Hospitals NHS Trust,0,0,3,0,1,0,0,0,1,1,2,6,14,57,8,1,4,1
Hampshire and Isle of Wight Healthcare NHS Foundation Trust,0,1,1,3,1,2,2,0,1,0,3,0,14,57,8,3,3,0
County Durham and Darlington NHS Foundation Trust,0,1,3,3,0,0,0,1,0,1,0,5,14,50,7,3,4,0
"Department for Business, Energy and Industrial Strategy",1,5,2,1,3,0,0,0,1,0,1,0,14,50,7,4,3,0
Department for Work and Pensions,0,1,0,2,1,1,1,0,3,1,2,2,14,50,7,4,2,1
Dorset Healthcare University NHS Foundation Trust,2,3,2,0,2,2,0,0,0,2,1,0,14,14,2,3,9,0
Hywel Dda University Health Board,0,3,1,3,0,1,4,0,0,1,0,1,14,57,8,1,5,0
Maritime and Coastguard Agency,0,2,0,3,1,1,0,4,0,0,2,1,14,36,5,7,1,1
Birmingham City Council,0,1,2,2,2,1,3,0,0,1,1,1,14,36,5,6,3,0
Durham County Council,0,2,0,2,1,1,2,2,1,1,1,1,14,79,11,1,2,0
Mersey Care NHS Foundation Trust,2,3,1,2,3,0,1,1,0,1,0,0,14,86,12,0,2,0
Royal College of Physicians,0,3,0,1,0,1,1,1,2,0,2,3,14,21,3,7,4,0
General Pharmaceutical Council,0,1,1,0,1,1,2,0,2,0,1,4,13,38,5,5,3,0
NHS Cornwall and Isles of Scilly Integrated Care Board,0,0,2,3,0,4,1,0,0,0,0,3,13,38,5,4,4,0
Lancashire and South Cumbria NHS Foundation Trust,1,1,2,2,2,1,0,1,1,1,1,0,13,38,5,1,7,0
University College London Hospitals NHS Foundation Trust,0,6,0,0,2,0,0,1,0,0,2,2,13,46,6,1,6,0
Sussex Police,0,0,1,0,1,1,2,2,2,2,0,2,13,46,6,3,4,0
East Lancashire Hospitals NHS Trust,0,2,2,4,1,0,0,0,2,0,0,2,13,46,6,0,7,0
"Foreign, Commonwealth and Development Office",0,1,1,1,2,2,0,0,0,1,3,2,13,38,5,1,7,0
Ashford and St Peter’s Hospitals NHS Foundation Trust,0,4,0,2,2,1,1,0,0,1,0,2,13,31,4,2,7,0
Driver and Vehicle Licensing Agency,1,0,2,1,2,2,0,0,3,0,1,1,13,15,2,5,6,0
HM Prison Pentonville,0,2,2,2,3,0,2,0,1,0,1,0,13,23,3,7,3,0
Oxford University Hospitals NHS Foundation Trust,0,1,0,1,2,2,1,1,3,0,2,0,13,62,8,2,3,0
Royal Cornwall Hospitals NHS Trust,1,3,0,1,0,1,0,1,0,0,4,2,13,38,5,1,6,1
NHS Sussex Integrated Care Board,0,1,1,1,1,2,0,0,3,0,1,3,13,62,8,5,0,0
Bolton NHS Foundation Trust,1,1,3,2,2,1,0,2,1,0,0,0,13,62,8,3,2,0
G4S,0,1,4,1,1,1,4,0,0,0,0,1,13,38,5,6,2,0
Royal College of Emergency Medicine,0,1,0,0,2,0,0,1,1,0,4,4,13,8,1,9,3,0
North Bristol NHS Trust,0,2,1,0,1,3,0,1,0,2,2,1,13,62,8,2,3,0
Portsmouth Hospitals University NHS Trust,0,2,0,2,2,0,3,0,0,1,1,1,12,42,5,5,2,0
Kent County Council,0,0,1,0,1,0,1,2,4,3,0,0,12,42,5,3,4,0
West Midlands Ambulance Service University NHS Foundation Trust,0,2,0,0,1,0,1,2,1,0,3,2,12,58,7,2,3,0
Coventry and Warwickshire Partnership NHS Trust,0,2,1,0,3,0,0,1,1,1,0,3,12,50,6,0,4,2
NHS Nottingham and Nottinghamshire Integrated Care Board,1,0,1,0,2,0,0,6,2,0,0,0,12,8,1,8,3,0
Sheffield Teaching Hospitals NHS Foundation Trust,0,2,1,0,0,0,1,1,2,3,0,2,12,42,5,1,6,0
Great Western Hospitals NHS Foundation Trust,0,1,1,1,5,0,0,1,0,1,2,0,12,58,7,1,4,0
"Cumbria, Northumberland, Tyne and Wear NHS Foundation Trust",0,0,0,0,0,0,2,0,2,1,3,4,12,75,9,0,2,1
Surrey and Sussex Healthcare NHS Trust,0,2,2,0,0,0,0,2,0,2,3,1,12,50,6,3,3,0
Mid Yorkshire Teaching NHS Trust,0,0,2,0,2,1,1,1,3,0,2,0,12,58,7,2,3,0
Norfolk and Norwich University Hospitals NHS Foundation Trust,0,2,2,0,0,0,2,1,3,1,0,1,12,42,5,4,3,0
Yorkshire Ambulance Service NHS Trust,0,1,1,1,4,0,1,1,0,0,1,2,12,67,8,2,1,1
North Cumbria Integrated Care NHS Foundation Trust,1,0,0,0,2,1,1,1,0,2,1,3,12,67,8,2,2,0
"Department for Environment, Food and Rural Affairs",0,3,0,0,0,1,3,1,1,0,2,0,11,27,3,6,2,0
Nottingham University Hospitals NHS Trust,1,1,1,0,1,0,1,1,2,2,1,0,11,73,8,1,2,0
Leeds City Council,0,2,1,0,0,2,1,0,2,0,2,1,11,91,10,0,1,0
Whittington Health NHS Trust,1,1,3,0,2,1,1,0,1,1,0,0,11,55,6,4,1,0
Practice Plus Group,0,0,0,0,1,1,0,0,2,3,3,1,11,45,5,6,0,0
Mid and South Essex NHS Foundation Trust,0,4,0,1,1,0,0,1,0,0,2,2,11,55,6,0,5,0
South West London and St George’s Mental Health NHS Trust,0,3,0,1,1,1,0,1,0,1,1,2,11,36,4,2,5,0
South Western Ambulance Service NHS Foundation Trust,0,1,2,1,2,1,0,1,0,0,2,1,11,36,4,3,4,0
South West Yorkshire Partnership NHS Foundation Trust,1,0,0,0,1,2,0,0,3,3,0,1,11,36,4,4,3,0
Norfolk County Council,0,4,2,1,0,0,1,0,2,0,0,1,11,64,7,2,2,0
Cornwall Partnership NHS Foundation Trust,0,0,0,3,0,2,2,0,1,0,2,1,11,64,7,3,1,0
"NHS Bedfordshire, Luton and Milton Keynes Integrated Care Board",0,3,0,0,0,3,2,0,0,0,3,0,11,64,7,2,2,0
Sandwell and West Birmingham Hospitals NHS Trust,0,0,0,3,1,2,0,0,2,0,2,1,11,64,7,3,1,0
Royal College of Surgeons,0,1,0,0,2,1,1,1,0,1,1,3,11,18,2,4,3,2
Devon and Cornwall Police,0,2,1,1,1,0,0,2,1,1,1,1,11,64,7,3,1,0
West London NHS Trust,0,0,1,2,0,1,1,0,1,3,1,1,11,45,5,0,6,0
Royal Free London NHS Foundation Trust,0,3,1,1,1,1,0,1,2,0,0,1,11,55,6,0,5,0
British Medical Association,0,1,0,2,0,1,3,0,1,1,0,2,11,18,2,5,4,0
Trafford Council,1,0,2,2,0,2,0,2,0,0,0,1,10,20,2,5,2,1
Cyngor Sir Powys County Council,0,2,0,4,0,0,0,0,0,4,0,0,10,20,2,2,6,0
South Tyneside and Sunderland NHS Foundation Trust,0,4,2,0,1,1,1,0,1,0,0,0,10,60,6,0,4,0
Royal United Hospitals Bath NHS Foundation Trust,0,1,1,1,1,0,3,0,0,0,3,0,10,50,5,2,3,0
Canal and River Trust,0,2,0,3,1,0,1,0,1,2,0,0,10,40,4,1,5,0
Calderdale Council,0,0,0,0,0,4,2,1,1,1,0,1,10,40,4,1,5,0
Royal Pharmaceutical Society,0,1,1,2,0,0,1,1,1,1,1,1,10,50,5,3,2,0
Egton Medical Information Systems,0,1,0,0,0,0,0,1,2,1,3,2,10,70,7,1,2,0
Frimley Health NHS Foundation Trust,1,3,0,1,0,0,0,0,1,1,1,2,10,50,5,3,2,0
Office for Product Safety and Standards,0,0,0,0,0,1,1,1,0,0,3,4,10,40,4,4,1,1
Walsall Healthcare NHS Trust,0,1,1,2,1,1,0,3,1,0,0,0,10,60,6,1,3,0
Warwickshire County Council,1,2,1,1,1,2,0,0,0,0,1,0,9,44,4,0,5,0
NHS West Yorkshire Integrated Care Board,0,1,1,0,0,1,0,0,0,0,3,3,9,11,1,5,3,0
Royal College of Pathologists,0,2,0,0,0,1,2,0,0,1,1,2,9,11,1,3,3,2
NHS Devon Integrated Care Board,0,2,2,2,1,1,0,0,0,1,0,0,9,33,3,3,3,0
Berkshire Healthcare NHS Foundation Trust,0,1,1,0,0,1,0,2,0,0,1,3,9,44,4,2,3,0
Circle Health Group,0,2,2,3,1,1,0,0,0,0,0,0,9,11,1,3,5,0
HC One,0,1,1,0,0,3,3,0,0,0,0,1,9,56,5,2,2,0
Staffordshire County Council,1,2,1,1,0,1,1,0,0,0,0,2,9,56,5,1,3,0
Maidstone and Tunbridge Wells NHS Trust,0,1,1,2,1,1,1,1,1,0,0,0,9,78,7,1,1,0
Lincolnshire County Council,0,0,2,1,0,1,2,2,0,0,1,0,9,56,5,2,2,0
Driver and Vehicle Standards Agency,1,2,0,0,1,0,2,2,0,0,0,1,9,22,2,4,3,0
The Dudley Group NHS Foundation Trust,0,1,1,1,2,4,0,0,0,0,0,0,9,78,7,1,1,0
NHS Wales,0,0,3,2,0,0,1,0,0,0,0,2,8,50,4,2,2,0
West Sussex County Council,0,0,2,1,1,0,2,1,1,0,0,0,8,75,6,1,1,0
Royal Berkshire NHS Foundation Trust,0,1,2,0,0,1,0,0,0,1,2,1,8,38,3,3,2,0
Resuscitation Council UK,0,0,0,3,0,0,0,1,2,1,1,0,8,62,5,0,3,0
Food Standards Agency,0,1,0,0,1,1,1,1,0,1,1,1,8,88,7,1,0,0
British Transport Police,0,1,2,0,0,0,0,0,1,0,3,1,8,50,4,3,1,0
Health Services Safety Investigations Body,0,0,0,0,0,2,1,3,1,0,1,0,8,25,2,3,3,0
Gloucestershire Hospital NHS Foundation Trust,0,0,1,0,1,2,3,0,0,0,1,0,8,62,5,0,3,0
Camden Council,0,2,0,1,0,1,1,2,0,0,0,1,8,50,4,2,2,0
Suffolk County Council,0,0,0,0,0,0,2,1,1,2,0,2,8,62,5,0,2,1
Hampshire and Isle of Wight Constabulary,0,1,0,1,0,0,4,0,0,0,1,1,8,38,3,1,4,0
Hampshire County Council,0,1,0,2,0,0,2,0,1,1,0,1,8,50,4,3,1,0
Isle of Wight Council,0,2,1,0,0,2,1,1,1,0,0,0,8,38,3,2,3,0
Chief Fire Officers Association,1,1,0,2,4,0,0,0,0,0,0,0,8,38,3,1,4,0
Sheffield Health and Social Care NHS Foundation Trust,0,0,1,0,2,1,0,0,0,2,1,1,8,62,5,0,2,1
Royal College of Radiologists,0,0,0,1,0,0,0,1,0,0,2,4,8,25,2,4,0,2
Royal Devon University Healthcare NHS Foundation Trust,0,2,3,0,1,0,1,0,0,0,1,0,8,50,4,2,2,0
Dorset Council,0,0,0,0,1,2,1,0,0,2,1,1,8,100,8,0,0,0
University Hospitals Bristol and Weston NHS Foundation Trust,0,1,0,1,1,0,1,0,0,1,2,1,8,38,3,1,3,1
Homerton Healthcare NHS Foundation Trust,0,0,0,1,2,2,0,0,1,0,1,1,8,38,3,2,2,1
"Wrightington, Wigan and Leigh Teaching Hospitals NHS Foundation Trust",1,0,0,3,3,0,0,0,0,1,0,0,8,62,5,2,1,0
The Royal Wolverhampton NHS Trust,0,0,0,3,3,0,1,0,0,1,0,0,8,38,3,1,4,0
"Bournemouth, Christchurch and Poole Council",0,0,0,0,0,0,1,2,1,1,1,1,7,71,5,1,1,0
Nottinghamshire County Council,0,0,0,1,1,1,1,0,2,0,1,0,7,43,3,2,2,0
Royal College of Nursing,1,0,0,0,0,0,1,2,0,1,0,2,7,29,2,4,1,0
Royal National Lifeboat Institution,0,1,0,0,1,0,0,4,0,0,1,0,7,29,2,5,0,0
Birmingham Women's and Children's NHS Foundation Trust,1,0,1,0,1,2,1,0,0,1,0,0,7,0,0,2,5,0
British Standards Institution,0,2,0,0,0,0,0,1,0,2,0,2,7,57,4,1,1,1
Office of Rail and Road,0,1,0,0,2,0,3,1,0,0,0,0,7,14,1,3,3,0
West Yorkshire Police,0,1,1,2,0,0,0,0,0,1,1,1,7,43,3,2,1,1
Epsom and St Helier University Hospitals NHS Trust,1,0,1,2,0,2,0,0,0,0,0,1,7,43,3,3,1,0
Lewisham and Greenwich NHS Trust,1,1,1,0,0,0,1,1,2,0,0,0,7,57,4,3,0,0
Stockport Council,0,0,1,1,0,0,1,1,1,0,0,2,7,57,4,1,2,0
Cheshire East Council,0,0,0,0,1,0,6,0,0,0,0,0,7,100,7,0,0,0
Sherwood Forest Hospitals NHS Foundation Trust,0,0,0,1,0,0,0,1,1,0,0,4,7,71,5,1,1,0
Independent Office for Police Conduct,0,3,0,0,0,0,0,0,1,1,0,2,7,29,2,3,1,1
Cheshire and Wirral Partnership NHS Foundation Trust,0,1,1,1,0,0,2,0,0,1,0,1,7,43,3,1,3,0
Joint Royal Colleges Ambulance Liaison Committee,0,0,0,0,1,0,3,1,0,1,1,0,7,14,1,2,4,0
South Wales Police,0,0,0,1,0,0,1,2,0,1,1,1,7,43,3,0,4,0
Calderdale and Huddersfield NHS Foundation Trust,0,0,3,1,0,0,2,0,0,1,0,0,7,29,2,0,5,0
Greater London Authority,1,0,0,1,0,0,0,0,3,1,0,1,7,29,2,5,0,0
Cambridgeshire County Council,0,1,0,0,0,0,0,0,1,1,3,1,7,71,5,0,2,0
Milton Keynes City Council,0,1,0,0,1,1,0,1,0,1,1,1,7,71,5,1,1,0
"Barnet, Enfield and Haringey Mental Health NHS Trust",0,1,2,0,1,0,0,0,0,0,2,1,7,29,2,2,2,1
Bedfordshire Police,0,0,0,1,1,1,1,0,1,0,1,1,7,43,3,3,1,0
Shrewsbury and Telford Hospital NHS Trust,0,1,0,1,0,1,1,2,1,0,0,0,7,57,4,0,3,0
NHS Lancashire and South Cumbria Integrated Care Board,0,1,0,0,0,1,1,1,1,0,2,0,7,71,5,2,0,0
Tower Hamlets Council,0,1,1,0,0,2,1,2,0,0,0,0,7,43,3,1,3,0
Guy's and St Thomas' NHS Foundation Trust,1,0,2,0,1,0,2,1,0,0,0,0,7,86,6,1,0,0
Dorset Police,0,0,0,0,0,1,1,0,1,2,2,0,7,71,5,2,0,0
Advisory Council on the Misuse of Drugs,0,1,3,1,0,0,0,1,1,0,0,0,7,14,1,2,4,0
Wiltshire Council,0,1,2,1,1,1,0,0,0,1,0,0,7,43,3,1,3,0
Devon County Council,1,0,1,1,0,1,0,0,2,0,1,0,7,43,3,0,4,0
Northumbria Police,0,1,0,1,0,0,2,1,0,0,0,2,7,29,2,1,3,1
Essex County Council,0,0,2,0,1,0,0,1,0,0,2,0,6,50,3,0,3,0
Oldham Council,1,3,0,0,1,0,0,0,0,1,0,0,6,33,2,2,2,0
Thames Valley Police,0,1,0,0,0,0,2,0,0,1,0,2,6,33,2,4,0,0
Wye Valley NHS Trust,0,0,0,0,0,0,1,1,0,1,2,1,6,83,5,0,1,0
University Health Board,0,0,2,0,3,0,1,0,0,0,0,0,6,33,2,0,4,0
Clinical Commissioning Group,1,1,1,0,1,0,1,0,1,0,0,0,6,33,2,0,4,0
University Hospitals Coventry and Warwickshire NHS Trust,1,0,0,2,0,1,1,0,0,0,1,0,6,33,2,0,4,0
UK Health Security Agency,0,0,0,0,0,0,0,0,0,1,3,2,6,33,2,1,2,1
James Paget University Hospitals NHS Foundation Trust,0,0,2,0,0,0,1,2,0,0,0,1,6,50,3,2,1,0
Royal Society for the Prevention of Accidents,0,2,0,0,1,0,0,0,0,0,1,2,6,0,0,3,2,1
North Yorkshire County Council,1,0,0,1,0,1,0,0,1,1,1,0,6,67,4,0,2,0
Rotherham Doncaster and South Humber NHS Foundation Trust,0,1,1,2,0,0,1,0,0,0,0,1,6,50,3,0,3,0
Rail Safety and Standards Board,1,0,2,1,1,0,0,0,1,0,0,0,6,17,1,1,4,0
National Trust,0,0,2,1,0,0,1,1,1,0,0,0,6,33,2,4,0,0
British Society of Gastroenterology,0,1,1,0,0,1,0,0,1,0,0,2,6,33,2,2,1,1
NHS Cheshire and Merseyside Integrated Care Board,0,1,0,0,2,1,0,0,0,0,1,1,6,33,2,3,1,0
Sheffield City Council,0,0,0,2,1,2,0,0,0,0,0,1,6,67,4,1,1,0
Sheffield Children’s NHS Foundation Trust,0,0,1,0,0,0,2,0,0,0,2,1,6,67,4,2,0,0
Hull University Teaching Hospitals NHS Trust,0,0,0,0,1,0,1,0,0,0,1,3,6,50,3,1,2,0
HM Prison Belmarsh,1,0,1,0,0,0,0,0,2,1,1,0,6,17,1,5,0,0
"NHS Leicester, Leicestershire and Rutland Integrated Care Board",0,0,0,1,2,1,0,1,0,1,0,0,6,67,4,1,1,0
NHS Lincolnshire Integrated Care Board,2,1,1,0,0,0,0,1,0,0,0,1,6,17,1,1,4,0
Leeds and York Partnership NHS Foundation Trust,0,0,0,2,0,0,1,0,2,0,1,0,6,83,5,1,0,0
Sandwell Council,0,2,0,0,1,1,1,0,0,0,0,1,6,33,2,2,2,0
Gloucestershire Health and Care NHS Foundation Trust,0,0,0,0,2,1,1,0,0,0,1,1,6,67,4,0,2,0
George Eliot Hospital NHS Trust,0,0,0,2,0,1,0,0,0,0,2,1,6,17,1,1,3,1
Tameside Metropolitan Borough Council,0,1,1,1,2,0,0,0,1,0,0,0,6,17,1,5,0,0
Isle of Wight NHS Trust,0,2,0,1,2,1,0,0,0,0,0,0,6,17,1,0,5,0
London North West University Healthcare NHS Trust,0,1,0,0,0,0,2,0,0,1,1,0,5,60,3,1,1,0
Local Government Association,0,0,0,0,1,1,2,0,0,0,0,1,5,20,1,3,1,0
Avon Fire and Rescue Services,0,0,0,3,0,0,0,0,0,0,2,0,5,40,2,2,1,0
Chief Medical Officer for Wales,0,0,0,0,2,0,1,0,0,0,2,0,5,40,2,1,2,0
Hertfordshire County Council,0,1,0,1,1,0,0,0,0,0,2,0,5,60,3,0,2,0
Hackney Council,0,0,0,1,0,1,0,0,0,0,0,3,5,40,2,2,0,1
Department for Business and Trade,0,1,1,0,0,0,0,1,0,0,0,2,5,0,0,2,2,1
The Princess Alexandra Hospital NHS Trust,0,0,0,1,0,1,0,1,0,0,0,2,5,80,4,0,1,0
HM Prison Wandsworth,0,0,0,0,2,0,0,0,0,0,0,3,5,0,0,1,4,0
HM Prison Long Lartin,0,1,0,0,1,0,1,0,2,0,0,0,5,60,3,0,2,0
HM Prison Winchester,1,1,1,1,0,0,1,0,0,0,0,0,5,0,0,2,3,0
Virgin Care,0,1,1,0,0,3,0,0,0,0,0,0,5,20,1,1,3,0
HM Prison Woodhill,0,0,0,1,2,0,2,0,0,0,0,0,5,20,1,2,2,0
Chesterfield Royal Hospital NHS Foundation Trust,0,1,0,1,1,0,0,1,0,0,1,0,5,20,1,1,3,0
North West Anglia NHS Foundation Trust,0,2,0,0,1,0,0,0,1,0,1,0,5,40,2,1,2,0
Borough Care,0,1,0,1,1,0,1,1,0,0,0,0,5,80,4,0,1,0
Essex Police,0,0,0,0,1,0,1,1,1,0,1,0,5,20,1,2,2,0
Oxford Health NHS Foundation Trust,0,0,0,0,0,0,0,0,1,1,2,1,5,80,4,0,1,0
North Middlesex University Hospital NHS Trust,1,0,0,2,0,0,1,0,0,0,0,1,5,40,2,1,2,0
Ofcom,0,0,0,0,0,0,0,0,0,0,2,3,5,20,1,2,1,1
Ofsted,0,1,0,0,2,0,0,0,1,0,1,0,5,60,3,0,2,0
West Suffolk NHS Foundation Trust,0,1,0,0,0,1,0,2,0,0,0,1,5,40,2,0,2,1
British Society for Allergy and Clinical Immunology,0,0,0,0,1,0,2,0,0,1,0,1,5,40,2,2,1,0
ABTA – The Travel Association,0,1,2,0,1,0,0,0,0,0,1,0,5,20,1,1,3,0
West Mercia Police,1,0,0,3,0,0,0,0,0,0,0,1,5,60,3,1,1,0
Derbyshire County Council,0,0,1,0,0,1,1,0,1,1,0,0,5,40,2,1,2,0
Derbyshire Healthcare NHS Foundation Trust,1,0,1,0,0,0,0,0,0,0,1,2,5,40,2,2,1,0
Wiltshire Police,0,1,0,0,0,1,1,1,0,0,1,0,5,40,2,1,2,0
Walsall Council,0,0,0,0,2,0,2,0,0,0,0,1,5,20,1,4,0,0
Northumbria Healthcare NHS Foundation Trust,0,0,1,0,0,0,2,0,1,0,0,1,5,60,3,2,0,0
Birmingham Community Healthcare NHS Foundation Trust,0,0,1,0,1,1,1,0,0,0,1,0,5,40,2,3,0,0
British National Formulary,0,2,0,0,0,1,0,0,0,0,1,1,5,40,2,1,2,0
Bury Council,0,1,1,0,1,1,0,1,0,0,0,0,5,80,4,1,0,0
NHS Surrey Heartlands Integrated Care Board,0,1,0,1,0,0,1,0,0,2,0,0,5,20,1,3,1,0
HM Prison Hewell,1,0,1,0,0,0,2,0,1,0,0,0,5,0,0,4,1,0
HCA Healthcare UK,0,0,0,0,2,0,1,0,1,0,0,1,5,60,3,2,0,0
BUPA,0,0,0,1,1,1,0,0,0,1,1,0,5,60,3,1,1,0
Stoke on Trent City Council,0,0,1,0,0,0,0,1,1,0,1,1,5,60,3,2,0,0
South Tees Hospitals NHS Foundation Trust,0,1,0,1,0,0,1,0,0,0,0,2,5,40,2,0,2,1
Mitie Group,0,0,0,1,0,0,2,0,1,0,0,1,5,20,1,0,4,0
NHS Hampshire and Isle of Wight Integrated Care Board,0,1,0,0,0,0,2,0,0,0,2,0,5,40,2,1,2,0
Sainsbury's,0,0,2,1,0,0,0,0,0,0,1,1,5,40,2,2,1,0
Cygnet Health Care,0,1,0,0,0,0,0,0,0,1,0,3,5,40,2,2,1,0
South Western Railway,0,0,0,1,0,0,2,1,0,1,0,0,5,0,0,3,2,0
Bolton Council,1,0,1,0,1,0,0,1,1,0,0,0,5,40,2,0,3,0
Rochdale Borough Council,0,2,1,0,0,1,1,0,0,0,0,0,5,40,2,0,3,0
Change Grow Live,0,0,0,0,2,0,0,0,2,1,0,0,5,20,1,3,1,0
London Fire Brigade,0,0,0,0,0,0,0,0,1,1,1,2,5,60,3,1,0,1
South Yorkshire Police,0,1,1,0,1,0,0,1,0,0,0,1,5,60,3,2,0,0
Greater Manchester Combined Authority,0,1,0,0,0,1,3,0,0,0,0,0,5,20,1,2,2,0
NHS Kent and Medway Integrated Care Board,0,0,0,0,0,0,0,0,0,1,3,1,5,40,2,0,3,0
NHS Norfolk and Waveney Integrated Care Board,0,1,0,0,0,0,1,0,1,0,1,1,5,80,4,1,0,0
South Warwickshire University NHS Foundation Trust,0,0,0,0,0,0,1,1,1,0,1,1,5,100,5,0,0,0
Lewisham Council,0,0,0,1,0,1,1,1,1,0,0,0,5,0,0,4,1,0
Staffordshire Police,0,1,1,0,0,1,0,0,2,0,0,0,5,20,1,3,1,0
Lancashire County Council,0,0,1,0,0,0,1,1,0,1,1,0,5,80,4,1,0,0
NHS South Yorkshire Integrated Care Board,0,0,0,0,0,0,1,0,0,2,1,0,4,25,1,3,0,0
NHS South West London Integrated Care Board,0,1,1,0,0,0,0,0,0,0,1,1,4,25,1,1,2,0
National Patient Safety Agency,0,3,1,0,0,0,0,0,0,0,0,0,4,0,0,0,4,0
Newham Council,0,0,1,0,0,0,0,0,0,0,0,3,4,50,2,0,1,1
Royal Yachting Association,0,0,0,3,0,0,0,0,0,0,0,1,4,25,1,0,2,1
Royal Surrey NHS Foundation Trust,0,1,0,1,1,0,0,0,0,1,0,0,4,0,0,3,1,0
NHS North East London Integrated Care Board,0,0,0,1,0,0,0,2,0,0,0,1,4,50,2,2,0,0
National Assembly for Wales,0,0,4,0,0,0,0,0,0,0,0,0,4,0,0,2,2,0
North Wales Local Authorities,0,0,0,0,0,0,0,0,0,0,4,0,4,0,0,1,3,0
North London Mental Health Partnership,0,1,0,0,0,0,0,0,0,0,0,3,4,25,1,0,1,2
Road Haulage Association,0,0,1,0,0,0,3,0,0,0,0,0,4,50,2,2,0,0
Plymouth City Council,0,1,2,0,0,0,0,0,0,1,0,0,4,0,0,0,4,0
Reading Borough Council,0,0,0,0,1,0,0,0,0,0,2,1,4,50,2,1,1,0
Redbridge Council,0,0,0,0,0,0,0,0,1,0,1,2,4,0,0,3,1,0
Youth Justice Board,0,3,0,0,0,0,0,0,0,1,0,0,4,50,2,1,1,0
Wirral University Teaching Hospital NHS Foundation Trust,0,2,0,0,1,0,0,0,0,0,1,0,4,50,2,0,2,0
Denbighshire County Council,0,1,1,0,1,0,0,0,0,0,1,0,4,50,2,1,1,0
Derbyshire Constabulary,1,0,0,0,0,0,0,0,0,0,1,2,4,50,2,0,1,1
West Hertfordshire Teaching Hospitals NHS Trust,0,1,0,0,1,0,0,1,0,0,0,1,4,75,3,0,1,0
Warwickshire Police,0,0,0,1,0,1,0,0,0,1,0,1,4,75,3,1,0,0
Brighton and Hove City Council,0,1,0,0,0,0,1,1,1,0,0,0,4,0,0,3,1,0
National Fire Chiefs Council,0,0,0,0,0,2,0,0,0,1,1,0,4,25,1,1,2,0
Prisons and Probation Ombudsman,0,2,0,1,0,0,1,0,0,0,0,0,4,0,0,2,2,0
British Association of Perinatal Medicine,0,0,0,0,0,0,0,1,1,0,1,1,4,25,1,2,1,0
South Tyneside Council,0,1,1,0,0,0,0,0,0,0,1,1,4,50,2,0,2,0
Cambridgeshire and Peterborough NHS Foundation Trust,1,0,0,2,0,0,0,0,0,1,0,0,4,0,0,0,4,0
East Suffolk and North Essex NHS Foundation Trust,0,0,1,0,0,0,0,1,0,0,0,2,4,50,2,1,1,0
Gateshead Health NHS Foundation Trust,0,0,0,0,2,0,1,0,0,0,1,0,4,25,1,0,3,0
Lancashire Teaching Hospitals NHS Foundation Trust,0,1,2,0,0,0,0,0,0,0,0,1,4,25,1,0,3,0
