sent_to,no. PFDs,overdue,pending,received,% received
Department of Health and Social Care,137,43,10,84,61
NHS England,106,12,6,88,83
Department for Transport,28,4,1,23,82
Home Office,25,11,4,10,40
HM Prison and Probation Service,20,11,1,8,40
REDACTED,19,4,8,7,37
Ministry of Justice,19,10,2,7,37
Care Quality Commission,19,6,2,11,58
National Institute for Health and Care Excellence,18,6,1,11,61
National Highways,14,2,0,12,86
College of Policing,12,4,0,8,67
Medicines and Healthcare Products Regulatory Agency,11,2,3,6,55
NHS Greater Manchester Integrated Care Board,11,3,0,8,73
Department for Education,9,1,5,3,33
Office for Product Safety and Standards,9,3,0,6,67
Royal College of Paediatrics and Child Health,9,1,0,8,89
University Hospitals Birmingham NHS Foundation Trust,9,1,0,8,89
Royal College of Emergency Medicine,8,1,1,6,75
Barts Health NHS Trust,8,1,2,5,62
"Ministry of Housing, Communities and Local Government",8,4,0,4,50
Health and Safety Executive,8,3,1,4,50
Royal College of Obstetricians and Gynaecologists,6,1,1,4,67
Sussex Partnership NHS Foundation Trust,6,2,0,4,67
Royal Free London NHS Foundation Trust,6,0,0,6,100
National Police Chiefs’ Council,6,2,0,4,67
Royal College of General Practitioners,6,3,0,3,50
North London NHS Foundation Trust,6,1,0,5,83
Metropolitan Police Service,6,1,1,4,67
Mid and South Essex NHS Foundation Trust,6,0,0,6,100
Worcestershire Acute Hospitals NHS Trust,6,1,0,5,83
"Department for Culture, Media and Sport",6,1,0,5,83
Welsh Government,5,2,0,3,60
University Hospitals of North Midlands NHS Trust,5,0,0,5,100
University Hospitals Sussex NHS Foundation Trust,5,1,0,4,80
Surrey and Borders Partnership NHS Foundation Trust,5,1,0,4,80
Aneurin Bevan University Health Board,5,1,0,4,80
Betsi Cadwaladr University Health Board,5,1,0,4,80
Doncaster and Bassetlaw Teaching Hospitals NHS Foundation Trust,5,1,2,2,40
South East Coast Ambulance Service NHS Foundation Trust,5,2,0,3,60
Stockport NHS Foundation Trust,5,2,1,2,40
"Tees, Esk and Wear Valley NHS Foundation Trust",4,0,1,3,75
Association of Ambulance Chief Executives,4,1,1,2,50
Royal College of Psychiatrists,4,2,1,1,25
West Yorkshire Police,4,0,0,4,100
Nottinghamshire Healthcare NHS Foundation Trust,4,1,0,3,75
Oxleas NHS Foundation Trust,4,3,0,1,25
Cwm Taf Morgannwg University Health Board,4,1,0,3,75
Essex Partnership University NHS Foundation Trust,4,0,0,4,100
Driver and Vehicle Licensing Agency,4,1,0,3,75
HM Prison Wandsworth,4,3,0,1,25
General Pharmaceutical Council,4,0,0,4,100
Milton Keynes University Hospital NHS Foundation Trust,4,2,0,2,50
Royal Cornwall Hospitals NHS Trust,4,1,0,3,75
Swansea Bay University Health Board,4,0,0,4,100
Oxford Health NHS Foundation Trust,4,0,1,3,75
NHS Derby and Derbyshire Integrated Care Board,4,1,0,3,75
National Fire Chiefs Council,4,1,0,3,75
University College London Hospitals NHS Foundation Trust,3,1,0,2,67
Transport for London,3,1,0,2,67
Royal College of Radiologists,3,0,0,3,100
Royal College of Physicians,3,0,0,3,100
Royal College of Pathologists,3,1,0,2,67
South Central Ambulance Service NHS Foundation Trust,3,2,0,1,33
Tameside and Glossop Integrated Care NHS Foundation Trust,3,0,0,3,100
Surrey and Sussex Healthcare NHS Trust,3,1,0,2,67
Somerset NHS Foundation Trust,3,0,1,2,67
Surrey County Council,3,0,0,3,100
Royal College of Surgeons,3,0,1,2,67
Ministry of Defence,3,0,0,3,100
Newham Council,3,1,0,2,67
Royal College of Anaesthetists,3,1,1,1,33
Northumbria Healthcare NHS Foundation Trust,3,1,0,2,67
North East London NHS Foundation Trust,3,0,0,3,100
North West Ambulance Service NHS Trust,3,0,0,3,100
Northern Care Alliance NHS Foundation Trust,3,0,0,3,100
Manchester University NHS Foundation Trust,3,0,1,2,67
East Midlands Ambulance Service NHS Trust,3,2,1,0,0
Greater Manchester Police,3,0,0,3,100
Central and North West London NHS Foundation Trust,3,1,0,2,67
Independent Office for Police Conduct,3,2,0,1,33
Leeds Teaching Hospitals NHS Trust,3,0,0,3,100
Midlands Partnership University NHS Foundation Trust,3,0,0,3,100
Harbour Healthcare Ltd,3,0,1,2,67
East Riding of Yorkshire Council,3,0,0,3,100
Devon Partnership NHS Trust,3,1,0,2,67
Department for Work and Pensions,3,1,1,1,33
"Department for Science, Innovation and Technology",3,1,0,2,67
Civil Aviation Authority,3,0,0,3,100
Cornwall Council,3,0,0,3,100
York and Scarborough Teaching Hospitals NHS Foundation Trust,3,0,1,2,67
West Midlands Police,3,1,0,2,67
South Tyneside and Sunderland NHS Foundation Trust,2,0,1,1,50
East Kent Hospitals University NHS Foundation Trust,2,1,0,1,50
East London NHS Foundation Trust,2,0,0,2,100
East Suffolk and North Essex NHS Foundation Trust,2,0,0,2,100
NHS Birmingham and Solihull Integrated Care Board,2,1,0,1,50
South West Yorkshire Partnership NHS Foundation Trust,2,0,0,2,100
South Western Ambulance Service NHS Foundation Trust,2,0,0,2,100
"Department for Environment, Food and Rural Affairs",2,1,0,1,50
British Association of Perinatal Medicine,2,0,0,2,100
The Royal Wolverhampton NHS Trust,2,1,0,1,50
Community Pharmacy England,2,0,0,2,100
Nottingham and Nottinghamshire Police,2,2,0,0,0
Nottinghamshire Police,2,1,0,1,50
Royal Pharmaceutical Society,2,0,0,2,100
Ofcom,2,0,0,2,100
NHS North East and North Cumbria Integrated Care Board,2,1,0,1,50
Oxford University Hospitals NHS Foundation Trust,2,0,0,2,100
The Newcastle upon Tyne Hospitals NHS Foundation Trust,2,0,2,0,0
Oxfordshire County Council,2,0,0,2,100
Calderdale and Huddersfield NHS Foundation Trust,2,0,1,1,50
Norfolk and Suffolk NHS Foundation Trust,2,0,0,2,100
Hull University Teaching Hospitals NHS Trust,2,0,0,2,100
Pennine Care NHS Foundation Trust,2,0,0,2,100
St George’s University Hospitals NHS Foundation Trust,2,0,0,2,100
Lancashire Teaching Hospitals NHS Foundation Trust,2,1,1,0,0
Priory Group Limited,2,0,0,2,100
General Medical Council,2,0,0,2,100
Gloucestershire Health and Care NHS Foundation Trust,2,1,0,1,50
Thames Valley Police,2,1,0,1,50
Tavistock and Portman NHS Foundation Trust,2,2,0,0,0
Greater Manchester Integrated Care Board,2,0,0,2,100
Surrey Police,2,0,0,2,100
Lewisham Council,2,2,0,0,0
Essex County Council,2,0,0,2,100
Essex Partnership University NHS Trust,2,0,0,2,100
Cardiff and Vale University Health Board,2,0,0,2,100
Birmingham and Solihull Mental Health NHS Foundation Trust,2,0,0,2,100
Blackpool Teaching Hospitals NHS Foundation Trust,2,1,0,1,50
HM Inspectorate of Prisons,2,0,1,1,50
Greater Manchester Mental Health NHS Foundation Trust,2,0,0,2,100
South London and Maudsley NHS Foundation Trust,2,0,1,1,50
Driver and Vehicle Standards Agency,2,2,0,0,0
Bradford Council,2,2,0,0,0
Epsom and St Helier University Hospitals NHS Trust,2,2,0,0,0
Islington Council,2,0,0,2,100
Hampshire and Isle of Wight Healthcare NHS Foundation Trust,2,1,0,1,50
Associated British Ports,2,0,0,2,100
Hampshire County Council,2,1,0,1,50
Care UK,2,1,0,1,50
NHS Dorset Integrated Care Board,2,1,0,1,50
UK Health Security Agency,2,1,0,1,50
Royal Society for the Prevention of Accidents,2,2,0,0,0
Association of Anaesthetists,2,0,1,1,50
University Hospitals Bristol and Weston NHS Foundation Trust,2,1,0,1,50
University Hospitals Plymouth NHS Trust,2,1,0,1,50
Birmingham City Council,2,1,0,1,50
Network Rail,2,1,0,1,50
Veterinary Medicines Directorate,2,0,0,2,100
Homerton Healthcare NHS Foundation Trust,2,0,0,2,100
SSP Health Medical Services Ltd,2,1,0,1,50
Herefordshire and Worcestershire Health and Care NHS Trust,2,0,0,2,100
NHS Sussex Integrated Care Board,2,0,0,2,100
Royal Yachting Association,2,0,0,2,100
Welsh Parliament,2,0,0,2,100
Welsh Ambulance Services University NHS Trust,2,0,0,2,100
Coventry and Warwickshire Partnership NHS Trust,2,0,0,2,100
CQC North,2,2,0,0,0
Inmind Healthcare Group,2,2,0,0,0
North Cumbria Integrated Care NHS Foundation Trust,2,0,0,2,100
Berkshire Healthcare NHS Foundation Trust,2,1,0,1,50
North East Ambulance Service NHS Foundation Trust,2,1,0,1,50
British Standards Institution,2,1,0,1,50
British Society of Gastroenterology,2,0,0,2,100
"Cumbria, Northumberland, Tyne and Wear NHS Foundation Trust",2,0,0,2,100
North West Anglia NHS Foundation Trust,2,0,0,2,100
"Barking, Havering and Redbridge University Hospitals NHS Trust",2,1,0,1,50
Royal College of Veterinary Surgeons,2,1,0,1,50
Royal Borough of Kensington and Chelsea,1,1,0,0,0
Pendine Park Care Organisation,1,0,0,1,100
Royal Borough of Greenwich,1,1,0,0,0
Royal Devon University Healthcare NHS Foundation,1,0,0,1,100
Red Oaks Care Community,1,0,0,1,100
Sedgemoor District Council,1,0,0,1,100
Royal Berkshire NHS Foundation Trust,1,0,0,1,100
Royal Devon University Healthcare NHS Foundation Trust,1,0,0,1,100
Redcar Council,1,0,0,1,100
Royal National Lifeboat Institution,1,0,0,1,100
Serco,1,0,0,1,100
Sanctuary Housing,1,0,0,1,100
Rotherham Metropolitan Borough Council,1,0,1,0,0
Pharmacy2U Limited,1,0,0,1,100
Road Transport Industry Training Board,1,1,0,0,0
Royal College of Radiology,1,1,0,0,0
Renal Association,1,1,0,0,0
Sheffield Health and Social Care NHS Foundation Trust,1,0,0,1,100
Rhondda Cynon Taf County Borough Council,1,1,0,0,0
Royal College of Nursing,1,0,0,1,100
Sheffield Teaching Hospitals NHS Foundation Trust,1,0,0,1,100
Revon Healthcare,1,0,0,1,100
Resus Council UK,1,0,0,1,100
Shrewsbury and Telford Hospital NHS Trust,1,0,0,1,100
Slough Pharmacy,1,0,0,1,100
Red Bay Boats Ltd,1,0,0,1,100
Rotherham Doncaster and South Humber NHS Foundation Trust,1,0,0,1,100
Officer of the College of Policing,1,1,0,0,0
Oldham Council,1,0,0,1,100
North Bristol NHS Trust,1,0,0,1,100
North Court Care Home – Maven Healthcare,1,0,0,1,100
North Middlesex University Hospital NHS Trust,1,0,0,1,100
North Yorkshire Council,1,0,0,1,100
Northampton General Hospital,1,0,0,1,100
Northampton General Hospital NHS Trust,1,0,0,1,100
Northamptonshire Children Safeguarding Partnership,1,0,0,1,100
Northamptonshire Healthcare Foundation Trust,1,0,0,1,100
National Institute for Health and Care Research,1,1,0,0,0
National Medical Examiner,1,1,0,0,0
Schindler Ltd,1,0,0,1,100
National Pharmaceutical Association,1,1,0,0,0
National Plant Operators Registration Scheme,1,1,0,0,0
National Police Air Service,1,0,0,1,100
National Register of Communication Professionals working with Deaf and Deafblind people (NRCPD),1,0,0,1,100
National Trading Standards,1,0,0,1,100
Neonatal Network,1,0,0,1,100
Network Agencies Estate Agents,1,1,0,0,0
Norfolk Community Health and Care NHS Trust,1,0,0,1,100
"NHS Shropshire, Telford and Wrekin ICB",1,0,1,0,0
NHS South West London Integrated Care Board,1,1,0,0,0
NHS Specialist Pharmacy Service,1,1,0,0,0
NHS Staffordshire and Stoke-on-Trent ICB,1,0,1,0,0
National Open College Network,1,1,0,0,0
Plymouth City Council,1,0,0,1,100
Portsmouth Hospitals University NHS Trust,1,0,0,1,100
Practice Plus Group,1,0,0,1,100
President of the Royal College of General Practitioners,1,0,1,0,0
Primary Care NHS Devon,1,1,0,0,0
Prime Life Limited,1,0,0,1,100
Pristine Care Group Ltd,1,0,0,1,100
Provident Housing,1,1,0,0,0
Queen Mary’s University of London,1,1,0,0,0
Cardiff & Vale University Health Board,1,0,0,1,100
Birmingham Women's and Children's NHS Foundation Trust,1,0,0,1,100
Bolton Council,1,0,0,1,100
Oak Tree Mews Care Home,1,1,0,0,0
Boomtown Festival,1,1,0,0,0
Bournemouth Airport,1,0,0,1,100
"Bournemouth, Christchurch and Poole Council",1,0,0,1,100
Bradford District Care NHS Foundation Trust,1,0,0,1,100
Brinnington Surgery,1,0,0,1,100
British Agricultural and Garden Machinery Association,1,1,0,0,0
British Airline Pilots’ Association,1,1,0,0,0
British Association for Counselling and Psychotherapy,1,0,0,1,100
Radis Community Care,1,0,0,1,100
Rail Safety Board,1,1,0,0,0
Northumberland Children’s and Adults Safeguarding Partnership,1,0,0,1,100
Northumbria Police,1,0,0,1,100
Nottingham University Hospitals NHS Trust,1,0,0,1,100
Bolton NHS Foundation Trust,1,1,0,0,0
Abbey Healthcare Homes Limited,1,0,0,1,100
Wandsworth Council,1,1,0,0,0
Ward Bros (Malton) Ltd,1,0,0,1,100
Warwickshire Police,1,0,1,0,0
West Midlands Ambulance Service University NHS Foundation Trust,1,0,1,0,0
West Midlands Fire Service,1,0,0,1,100
University Hospitals of Derby and Burton NHS Foundation Trust,1,0,0,1,100
The Pembroke Medical Practice,1,0,0,1,100
The Petroleum Enforcement Liaison Group,1,1,0,0,0
The Princess Alexandra Hospital NHS Trust,1,0,0,1,100
The Red House (Ashtead) Limited,1,0,0,1,100
The Riverside Group Limited,1,0,0,1,100
The Road Surface Treatments Association,1,1,0,0,0
Barchester Healthcare Ltd,1,0,0,1,100
The Rotherham NHS Foundation Trust,1,1,0,0,0
The Royal College of General Practitioners (RCGP),1,0,0,1,100
The Royal Orthopaedic Hospital NHS Foundation Trust,1,0,0,1,100
The Telecare Services Association,1,0,0,1,100
The Unite Group plc,1,0,0,1,100
The Yacht Harbour Association,1,0,0,1,100
TomTom,1,0,0,1,100
The Chief Executive Total Security Services Limited (TSS),1,0,1,0,0
The Chief Executive of Powys Teaching Hospital Board,1,0,1,0,0
"The Chief Executive, Great Western Hospitals, NHS Trust Marlborough Road, Swindon, SN3 6BB",1,0,1,0,0
"The Chief Executive, Tameside and Glossop Integrated Care NHS  Foundation Trust",1,0,1,0,0
The Children's Trust,1,0,0,1,100
The Children’s Trust,1,0,0,1,100
The Robert Jones and Agnes Hunt Orthopaedic Hospital NHS Foundation Trust,1,0,0,1,100
Willow Grange Care Home,1,0,0,1,100
Wrexham County Borough Council,1,0,0,1,100
York & Scarborough NHS Trust,1,1,0,0,0
York Road Pharmacy,1,0,0,1,100
West Suffolk NHS Foundation Trust,1,1,0,0,0
All Care In One Ltd,1,0,0,1,100
Alexandra Homes Ltd,1,0,0,1,100
Alexandra & Crestview Surgeries,1,1,0,0,0
Airedale NHS Foundation Trust,1,0,0,1,100
Agricultural Engineers Association,1,0,0,1,100
Affinity Water,1,0,0,1,100
Advisory Council on the Misuse of Drugs,1,1,0,0,0
Addison House Surgery,1,0,1,0,0
Yorkshire Ambulance Service NHS Trust,1,0,0,1,100
1st Care 4U,1,1,0,0,0
49 Marine Avenue Surgery,1,0,0,1,100
Arts University Bournemouth,1,0,0,1,100
Ashton Lodge Care Home,1,1,0,0,0
Aspray House Nursing Home,1,0,0,1,100
Association for Petroleum and Explosives Administration,1,1,0,0,0
[REDACTED] Chief Executive of Digital Health & Care Wales,1,0,1,0,0
Association of Coloproctology of Great Britain,1,0,0,1,100
"Association of Directors of Environment, Economy, Planning & Transport",1,1,0,0,0
Association of Manufacturers of Domestic Appliances,1,0,0,1,100
Atlantic Reach Limited,1,0,0,1,100
Attleborough Surgery,1,0,0,1,100
Avery Healthcare,1,0,0,1,100
Abbey Place Nursing Home,1,0,0,1,100
Suffolk County Council,1,0,0,1,100
Social Work England,1,0,0,1,100
Sodexo,1,0,0,1,100
Somerset NHS Foundation Trust (Musgrove Park Hospital Trust),1,0,0,1,100
South Tees Hospitals NHS Foundation Trust,1,0,0,1,100
South Wales Police,1,0,0,1,100
South West London and St George’s Mental Health NHS Trust,1,1,0,0,0
South Western Railway,1,0,0,1,100
British Marine,1,0,0,1,100
BARCHESTER HEALTHCARE LIMITED,1,0,0,1,100
BARDOC,1,1,0,0,0
BSI Group,1,0,0,1,100
BT,1,0,1,0,0
The City of London,1,1,0,0,0
Basildon Car Park Management,1,1,0,0,0
Beccles Medical Centre,1,1,0,0,0
Bedford General Hospital,1,1,0,0,0
Bedford Hospitals NHS Foundation Trust,1,0,0,1,100
Bedfordshire Hospitals NHS Foundation Trust,1,1,0,0,0
Belle Green Court Care Home,1,0,0,1,100
South Yorkshire Police,1,0,0,1,100
Southampton City Council,1,1,0,0,0
Royal Surrey NHS Foundation Trust,1,1,0,0,0
Russells Hall Hospital,1,1,0,0,0
SSP Health Ltd,1,0,0,1,100
Sainsbury's,1,0,0,1,100
Salford City Council,1,0,0,1,100
NHS Suffolk and North East Essex Integrated Care Board,1,1,0,0,0
The Crown Premises Fire & Safety Inspectorate,1,0,1,0,0
The First Minister of Wales,1,0,0,1,100
The Governor HMP Stocken,1,0,1,0,0
The Lakes Care Centre,1,0,0,1,100
The Lift and Escalator Industry Association,1,1,0,0,0
The Manor Clinic Folkestone Kent,1,1,0,0,0
The Manor House North Walsham Care Home,1,0,0,1,100
The Medicine and Healthcare Products and Regulatory Agency,1,0,0,1,100
The Nerams Group,1,0,0,1,100
Sussex Police,1,0,0,1,100
Tameside Metropolitan Borough Council,1,0,0,1,100
The British Orthopaedic Association,1,0,0,1,100
The Chief Executive Cardiff & Vale University Health Board,1,0,1,0,0
Stryker (UK) Ltd,1,0,0,1,100
The Chief Executive Tesco PLC,1,0,1,0,0
Southwark Council,1,1,0,0,0
Springcare Care Homes Ltd,1,0,0,1,100
St Mungo’s,1,0,0,1,100
Staffordshire County Council,1,0,0,1,100
Staffordshire Highways,1,0,0,1,100
Staffordshire Moorlands District Council,1,0,0,1,100
Steps 2 Recovery,1,0,0,1,100
Stewarts Law,1,1,0,0,0
Stockport Council,1,0,0,1,100
Stockton Council,1,0,0,1,100
Stoke Mandeville Hospital,1,1,0,0,0
Stoke Talking Therapies,1,1,0,0,0
The Chief Executive Security Industry Authority (SIA),1,0,1,0,0
Four Seasons Health Care,1,0,0,1,100
Fresh Student Living,1,0,0,1,100
Frimley Health NHS Foundation Trust,1,0,0,1,100
G4S Care & Justice Services UK Ltd,1,1,0,0,0
GTD Healthcare,1,0,0,1,100
Gateshead Council,1,0,0,1,100
General Chiropractic Council,1,0,0,1,100
General Dental Council,1,0,0,1,100
George Eliot Hospital NHS Trust,1,0,0,1,100
Google,1,0,0,1,100
Gray’s Inn Road Medical Centre,1,0,0,1,100
Elysium Healthcare,1,0,0,1,100
Emergency Call Prioritisation Advisory Group,1,1,0,0,0
NHS Kent and Medway Integrated Care Board,1,1,0,0,0
Esher Green Surgery,1,0,0,1,100
European Aviation Safety Agency,1,1,0,0,0
European Union Aviation Safety Authority,1,0,0,1,100
Faculty of Intensive Care Medicine,1,0,0,1,100
Festimed,1,0,0,1,100
Financial Conduct Authority,1,0,0,1,100
Fixodent,1,0,0,1,100
Flixton Road Medical Centre,1,0,0,1,100
Food Standards Agency,1,0,1,0,0
Downshaw Lodge,1,0,0,1,100
Durham Constabulary,1,0,0,1,100
Durham County Council,1,0,0,1,100
ERYC Highways Department,1,0,0,1,100
Energy Institute,1,0,0,1,100
Health Services Safety Investigations Body,1,1,0,0,0
Cornwall Partnership NHS Foundation Trust,1,0,0,1,100
County Durham & Darlington NHS Foundation Trust,1,1,0,0,0
Cardinal Health,1,0,0,1,100
Care4U Healthcare,1,1,0,0,0
Caremark Limited,1,0,0,1,100
Central London Community Healthcare NHS Trust,1,0,0,1,100
Chelsea and Westminster Hospital NHS Foundation Trust,1,1,0,0,0
Cheshire Constabulary,1,0,0,1,100
Chief Constable Greater Manchester Police,1,0,1,0,0
Chief Executive Hertfordshire County Council,1,0,1,0,0
Chief Executive North West Ambulance Service,1,0,1,0,0
Chief Executive Of Aneurin Bevan University Health Board,1,0,1,0,0
"Foreign, Commonwealth and Development Office",1,1,0,0,0
Health Services Safety Investigations Body (HSSIB),1,0,1,0,0
Health and Care Professions Council,1,1,0,0,0
Green Range Limited,1,0,0,1,100
HM Prison & Probation Service,1,0,0,1,100
HM Prison Eastwood Park,1,1,0,0,0
HM Prison Elmley,1,1,0,0,0
HM Prison Guys Marsh,1,1,0,0,0
HM Prison Leeds,1,0,1,0,0
HM Prison Lowdham Grange,1,0,1,0,0
HM Prison Ranby,1,0,0,1,100
HM Prison Rochester,1,0,0,1,100
HM Prison Swaleside,1,1,0,0,0
HM Prison Woodhill,1,1,0,0,0
HM Prison Wormwood Scrubs,1,0,0,1,100
Chief Executive Of Velindre University Nhs Trust,1,0,1,0,0
Dalton Surgery,1,0,0,1,100
Darnall Grange Care Home,1,0,0,1,100
Daryel Care,1,0,0,1,100
Daynight Pharmacy,1,1,0,0,0
Dearne Valley Group Practice,1,0,0,1,100
Avon and Somerset Police,1,0,0,1,100
Avon and Wiltshire Mental Health Partnership NHS Trust,1,1,0,0,0
West Sussex County Council,1,0,0,1,100
Westminster City Council,1,1,0,0,0
White Horse Medical Practice,1,0,1,0,0
Whittington Health,1,0,0,1,100
Whittington Health NHS Trust,1,0,0,1,100
Wigan Metropolitan Borough Council,1,0,0,1,100
East Kent Hospitals NHS Trust,1,0,0,1,100
Trafford Council,1,0,0,1,100
UK Cleaning Product Industry Association,1,0,0,1,100
UK Kidney Association,1,1,0,0,0
UK Major Ports Group,1,0,0,1,100
Uber Eats,1,0,1,0,0
United Kingdom Harbour Masters' Association,1,0,0,1,100
University Hospitals of Morecambe Bay NHS Foundation Trust,1,0,0,1,100
University of Arts London,1,0,0,1,100
Victoria Residential Home,1,0,0,1,100
A&B Healthcare Ltd,1,1,0,0,0
Townhead Surgery,1,0,0,1,100
Tower Hamlets Council,1,1,0,0,0
Williams and Spenceley Limited,1,1,0,0,0
WIGAN INTERGRATED CARE BOARD,1,1,0,0,0
Apple,1,0,0,1,100
East Riding Council,1,0,1,0,0
Eastcroft Nursing Home,1,1,0,0,0
Eastleigh Borough Council,1,0,0,1,100
Egton Medical Information Systems,1,0,1,0,0
Derbyshire Constabulary,1,0,0,1,100
Devon ICB,1,0,0,1,100
Devon Integrated Care Board,1,1,0,0,0
Devon and Cornwall Police,1,0,0,1,100
Difficult Airway Society,1,1,0,0,0
Doncaster Council,1,1,0,0,0
Deliveroo,1,0,1,0,0
Department for Business and Trade,1,1,0,0,0
Chief Executive Whittington Health NHS Trust Whittington Hospital,1,0,1,0,0
Cyngor Gwynedd Council,1,0,0,1,100
Chief Executive of Worcestershire County Council,1,0,1,0,0
"Chief Executive, Integrated Care Board",1,0,1,0,0
Chief Midwifery Officer,1,1,0,0,0
"Chief Nursing Officer, NHS North-East London Integrated Care Board",1,0,1,0,0
Circle Health Group Ltd,1,0,0,1,100
Clare House Surgery,1,0,0,1,100
Clough Williams-Ellis Trust,1,0,0,1,100
Complex Spine Clinic,1,0,0,1,100
Dorset Council,1,0,0,1,100
Crisis Resolution Team,1,1,0,0,0
Croydon Council,1,1,0,0,0
Croydon University Hospital,1,0,1,0,0
Cumbria Health Limited,1,0,0,1,100
Cyngor Bwrdeistref Sirol Pen-y-Bont ar Ogwr,1,1,0,0,0
Chief Executive of Cheshire and Wirral Partnership NHS Trust,1,0,1,0,0
Cambridgeshire and Peterborough ICB,1,0,0,1,100
Capital Care Group,1,1,0,0,0
NHS Mid and South Essex Integrated Care Board,1,1,0,0,0
Mills Family Ltd,1,0,0,1,100
Milton Keynes City Council,1,0,0,1,100
Milton Keynes Urgent Care Service,1,1,0,0,0
Minster Care Group,1,1,0,0,0
Mitie Group,1,0,0,1,100
Moorbridge School,1,0,0,1,100
Mountfield Surgery,1,0,0,1,100
"Mr Nick Mallaband, Acting Chief Medical Director, Doncaster & Bassetlaw NHS Foundation Trust",1,0,1,0,0
Musgrove Park Hospital,1,1,0,0,0
NEATH PORT TALBOT COUNCIL,1,0,0,1,100
Hatton Traffic Management,1,0,0,1,100
Mandeville Grange Nursing Home,1,0,0,1,100
Maritime and Coastguard Agency,1,0,0,1,100
Meanwood Group Practice,1,0,0,1,100
Medical Research Council,1,1,0,0,0
Medical Schools Council,1,1,0,0,0
Medicines and Healthcare Projects Regulation Authority,1,0,0,1,100
Merthyr Tydfil County Borough Council,1,1,0,0,0
Metropolitan Police Service (MPS),1,0,0,1,100
Mid and West Wales Fire and Rescue Service,1,0,0,1,100
Middlesbrough Council,1,0,0,1,100
Midway Pharmacy,1,0,0,1,100
Lincolnshire Police,1,1,0,0,0
Little Trethew Horningtops,1,0,0,1,100
LivaNova UK Limited,1,0,0,1,100
NHS Birmingham and Solihull ICB,1,0,1,0,0
NHS Sussex,1,0,0,1,100
NHS University Hospitals Trust Plymouth,1,0,0,1,100
NHS Wales,1,0,0,1,100
NHS West Yorkshire Integrated Care Board,1,0,0,1,100
NRS Healthcare,1,0,0,1,100
National Ambulance Services Medical Directors,1,1,0,0,0
National Care Consortium Ltd,1,0,0,1,100
National Director FOR Mental Health,1,0,1,0,0
National Farmers Union,1,0,0,1,100
NHS Black Country ICB,1,0,1,0,0
NHS Cambridgeshire and Peterborough Integrated Care Board,1,0,0,1,100
NHS Cornwall and Isles of Scilly ICB,1,0,0,1,100
NHS Coventry and Warwickshire ICB,1,0,1,0,0
Cabinet Secretary for Health and Social Care,1,0,1,0,0
NHS Frimley Integrated Care Board,1,1,0,0,0
NHS Herefordshire and Worcestershire ICB,1,0,1,0,0
NHS Hertfordshire and West Essex Integrated Care Board,1,0,0,1,100
ASHTON MEDICAL PRACTICE,1,1,0,0,0
NHS Lancashire and South Cumbria Integrated Care Board,1,0,0,1,100
Chief Executive Oldham Borough Council,1,0,1,0,0
Chief Executive Pennine Care NHS Foundation Trust,1,0,1,0,0
British Ports Association,1,0,0,1,100
British Society for Allergy and Clinical Immunology,1,0,0,1,100
British Society for Haematology (BSH),1,1,0,0,0
British Transplantation Society,1,1,0,0,0
British Transport Police,1,1,0,0,0
CGL (Ealing RISE),1,1,0,0,0
Cabinet Office,1,0,1,0,0
NHS Education for Scotland,1,0,0,1,100
Integrated Care Board (NHS North East and North Cumbria),1,0,0,1,100
International Powered Access Federation,1,1,0,0,0
Jaguar Land Rover,1,0,0,1,100
James Paget University NHS Foundation Trust,1,0,0,1,100
Just Eats,1,0,1,0,0
Kenny & Murphy Limited,1,1,0,0,0
Kent Central Ambulance Service,1,0,0,1,100
Kent Police,1,1,0,0,0
Henning Hall Nursing Home,1,1,0,0,0
Herefordshire Council,1,0,0,1,100
Hertfordshire County Council,1,0,0,1,100
Hillcare Group,1,1,0,0,0
His Majesty’s Prison & Probation Service,1,0,1,0,0
London Ambulance Service NHS Trust,1,1,0,0,0
Holderness Health – Hedon Group Practice.,1,1,0,0,0
Home Group Limited,1,1,0,0,0
"Hospital Manager, Goring Hall",1,0,1,0,0
Hotpoint UK Appliances Limited,1,1,0,0,0
Hounslow Council,1,0,0,1,100
Howlish Hall Care Home,1,0,0,1,100
HM Prison Wymott,1,0,0,1,100
HMP Coldingley,1,1,0,0,0
Hackney Council,1,0,0,1,100
Haddon Court Limited,1,0,0,1,100
Hampshire and IOW Constabulary,1,1,0,0,0
Hampshire and Isle of Wight Constabulary,1,0,0,1,100
Happy at Home Community Care Services Ltd,1,0,0,1,100
Hartlepool Council,1,0,0,1,100
Holcroft Grange,1,1,0,0,0
London Borough of Barking and Dagenham,1,0,0,1,100
London Borough of Bexley,1,1,0,0,0
London Borough of Bromley,1,0,0,1,100
London Borough of Hammersmith & Fulham,1,1,0,0,0
London Borough of Havering,1,0,0,1,100
London Borough of Richmond upon Thames,1,1,0,0,0
London Fire Brigade,1,0,0,1,100
London Fire Brigade (LFB),1,1,0,0,0
London Metropolitan Police,1,0,0,1,100
Lukka Care Homes Limited,1,0,0,1,100
Macklin Street Surgery,1,0,0,1,100
"Managing Director, Sussex Medical Chambers",1,0,1,0,0
Kingkabs Limited,1,0,0,1,100
Independent Training Standards Scheme and Register,1,1,0,0,0
Lambeth Council,1,1,0,0,0
Lantra,1,1,0,0,0
Leeds City Council,1,1,0,0,0
Leeds Community Healthcare NHS Trust,1,0,0,1,100
Leeds Survivor-Led Crisis Service (Leeds OASIS),1,0,1,0,0
Leeds and Yorkshire Partnership Foundation Trust (Intensive Supportive Service),1,0,1,0,0
Leicestershire County Council,1,0,0,1,100
Leicestershire Partnership NHS Trust,1,0,1,0,0
Lewisham and Greenwich NHS Trust,1,0,0,1,100
Lifeway Care Ltd,1,0,0,1,100
Lincolnshire County Council,1,1,0,0,0
Hull City Council,1,0,0,1,100
Humber Teaching NHS Foundation Trust,1,0,0,1,100
Hywel Dda University Health Board,1,0,0,1,100
Kingston Council,1,1,0,0,0
